{
  "artifacts": {
    "hypotheses_sha256": "0d4e3d62c8c56fa70fbc8c1060cc8a3a96a5bb493b03e2a14d2f90026143c3ed"
  },
  "data_provenance": {
    "common_voice_ja_26": {
      "attribution": {
        "creator": "Mozilla Foundation / Common Voice contributors",
        "dataset_id": "common_voice_ja_26",
        "required": false,
        "source_url": "https://mozilladatacollective.com/datasets/cmqim4lxy00tunr07cjkcupeg",
        "spdx": "CC0-1.0",
        "title": "Common Voice Scripted Speech 26.0 - Japanese"
      },
      "audit_status": "experimental",
      "license_policy": "strict",
      "license_spdx": "CC0-1.0",
      "prepared_lock_sha256": "87352287293cfb7f98ea8d6408a924a2435ed9b314f4c29850a28fc1a511a09e",
      "prepared_manifest_sha256": "0497e82fbb3d4a82f2876108cfbad9c850a16a98b803ef2924c6b2b25996b19e",
      "selected_count": 1000,
      "source_manifest_sha256": "71ca626b2d041e6c142301efc7c159587e8ffa5dddc962db3c72dd1cff4ca504",
      "source_release": "cv-corpus-26.0-2026-06-12",
      "source_revision": null,
      "source_split": "test",
      "source_view": "official",
      "version": "26.0"
    },
    "fleurs_ja": {
      "attribution": {
        "creator": "Google",
        "dataset_id": "fleurs_ja",
        "required": true,
        "source_url": "https://huggingface.co/datasets/google/fleurs",
        "spdx": "CC-BY-4.0",
        "title": "FLEURS - Japanese"
      },
      "audit_status": "experimental",
      "license_policy": "strict",
      "license_spdx": "CC-BY-4.0",
      "prepared_lock_sha256": "d4b95bdd6c5b9bd849b47fe38b31880b27314c643f2fb57c7aad1af95cf6c7b5",
      "prepared_manifest_sha256": "2ea73137377569b052f0e9228c1d36fb3eb9b62acc297d65ae65398f4f1844b8",
      "selected_count": 300,
      "source_manifest_sha256": "1dc7c3d3765286460c3f27045cc6f1f381e969a22320a777e693039b6083955b",
      "source_release": null,
      "source_revision": "70bb2e84b976b7e960aa89f1c648e09c59f894dd",
      "source_split": "test",
      "source_view": "official",
      "version": "70bb2e84b976b7e960aa89f1c648e09c59f894dd"
    }
  },
  "datasets": {
    "common_voice_ja_26": {
      "audio_s": 4761.468000000002,
      "decode_failures": 0,
      "decode_s": 48.38545558435726,
      "latency_ms_p50": 43.986854507238604,
      "latency_ms_p95": 90.41910895757609,
      "normalized": {
        "cer": 0.24151052454120708,
        "deletions": 2739,
        "insertions": 418,
        "reference_chars": 20761,
        "substitutions": 1857
      },
      "peak_rss_bytes": 596131840,
      "raw": {
        "cer": 0.28968504647594984,
        "deletions": 4043,
        "insertions": 381,
        "reference_chars": 22162,
        "substitutions": 1996
      },
      "rtf": 0.010161877720139512,
      "samples": 1000,
      "sentence_exact_rate": 0.37
    },
    "fleurs_ja": {
      "audio_s": 3936.479999999999,
      "decode_failures": 0,
      "decode_s": 36.29000037300284,
      "latency_ms_p50": 114.45137498958502,
      "latency_ms_p95": 184.25469229696319,
      "normalized": {
        "cer": 0.08956810631229235,
        "deletions": 443,
        "insertions": 163,
        "reference_chars": 15050,
        "substitutions": 742
      },
      "peak_rss_bytes": 786448384,
      "raw": {
        "cer": 0.14775758327647168,
        "deletions": 1428,
        "insertions": 133,
        "reference_chars": 16121,
        "substitutions": 821
      },
      "rtf": 0.009218896164340438,
      "samples": 300,
      "sentence_exact_rate": 0.20666666666666667
    }
  },
  "environment": {
    "machine": "arm64",
    "os": "Darwin",
    "platform": "macOS-26.6.2-arm64-arm-64bit",
    "python": "3.11.9",
    "threads": 4
  },
  "failures": [],
  "metrics": {
    "dataset_macro_cer": 0.1655393154267497,
    "decode_failures": 0,
    "deletions": 3182,
    "insertions": 581,
    "normalized_micro_cer": 0.1776549105023596,
    "p50_latency_ms": 50.63227051869035,
    "p95_latency_ms": 143.02965033712098,
    "peak_rss_bytes": 786448384,
    "raw_micro_cer": 0.2299192853224669,
    "reference_chars": 35811,
    "rtf": 0.009735107172100837,
    "sentence_exact_rate": 0.3323076923076923,
    "substitutions": 2599
  },
  "qc": {
    "flagged_samples": 592,
    "view": "official"
  },
  "run_id": "20260829T233330Z-hayamimi-ja-6261f9cb",
  "schema_version": 1,
  "subsets": {
    "digits": {
      "digit-containing": {
        "audio_s": 1459.9199999999996,
        "decode_failures": 0,
        "decode_s": 13.534522541915067,
        "latency_ms_p50": 121.87866598833352,
        "latency_ms_p95": 216.57566189242058,
        "normalized": {
          "cer": 0.13781877373846987,
          "deletions": 217,
          "insertions": 84,
          "reference_chars": 5529,
          "substitutions": 461
        },
        "peak_rss_bytes": 786448384,
        "raw": {
          "cer": 0.19623655913978494,
          "deletions": 597,
          "insertions": 61,
          "reference_chars": 5952,
          "substitutions": 510
        },
        "rtf": 0.00927072890426535,
        "samples": 103,
        "sentence_exact_rate": 0.0
      },
      "no-ascii-digits": {
        "audio_s": 7238.028000000001,
        "decode_failures": 0,
        "decode_s": 71.14093341544503,
        "latency_ms_p50": 48.76370800775476,
        "latency_ms_p95": 129.31586680933833,
        "normalized": {
          "cer": 0.18492834026814609,
          "deletions": 2965,
          "insertions": 497,
          "reference_chars": 30282,
          "substitutions": 2138
        },
        "peak_rss_bytes": 786448384,
        "raw": {
          "cer": 0.23612013238068727,
          "deletions": 4874,
          "insertions": 453,
          "reference_chars": 32331,
          "substitutions": 2307
        },
        "rtf": 0.009828772894418898,
        "samples": 1197,
        "sentence_exact_rate": 0.3609022556390977
      }
    },
    "duration": {
      "long": {
        "audio_s": 5075.375999999995,
        "decode_failures": 0,
        "decode_s": 46.810317872907035,
        "latency_ms_p50": 104.84108349191956,
        "latency_ms_p95": 172.12654549657594,
        "normalized": {
          "cer": 0.10889703753739265,
          "deletions": 809,
          "insertions": 273,
          "reference_chars": 20726,
          "substitutions": 1175
        },
        "peak_rss_bytes": 786448384,
        "raw": {
          "cer": 0.1671013580357946,
          "deletions": 2202,
          "insertions": 215,
          "reference_chars": 22238,
          "substitutions": 1299
        },
        "rtf": 0.009223024633624599,
        "samples": 414,
        "sentence_exact_rate": 0.18115942028985507
      },
      "medium": {
        "audio_s": 2977.4400000000032,
        "decode_failures": 0,
        "decode_s": 30.055218212597538,
        "latency_ms_p50": 47.555541998008266,
        "latency_ms_p95": 70.78314101090655,
        "normalized": {
          "cer": 0.1839246307927347,
          "deletions": 972,
          "insertions": 234,
          "reference_chars": 11782,
          "substitutions": 961
        },
        "peak_rss_bytes": 786432000,
        "raw": {
          "cer": 0.23356442744441788,
          "deletions": 1683,
          "insertions": 211,
          "reference_chars": 12549,
          "substitutions": 1037
        },
        "rtf": 0.010094315322087936,
        "samples": 609,
        "sentence_exact_rate": 0.4006568144499179
      },
      "short": {
        "audio_s": 645.1320000000005,
        "decode_failures": 0,
        "decode_s": 7.809919871855527,
        "latency_ms_p50": 28.666291007539257,
        "latency_ms_p95": 34.00392560870387,
        "normalized": {
          "cer": 0.5867393278837421,
          "deletions": 1401,
          "insertions": 74,
          "reference_chars": 3303,
          "substitutions": 463
        },
        "peak_rss_bytes": 596131840,
        "raw": {
          "cer": 0.6164187643020596,
          "deletions": 1586,
          "insertions": 88,
          "reference_chars": 3496,
          "substitutions": 481
        },
        "rtf": 0.01210592541038969,
        "samples": 277,
        "sentence_exact_rate": 0.40794223826714804
      }
    },
    "gender": {
      "do_not_wish_to_say": {
        "audio_s": 11.196,
        "decode_failures": 0,
        "decode_s": 0.13022854100563563,
        "latency_ms_p50": 33.678895502816886,
        "latency_ms_p95": 45.26058298361022,
        "normalized": {
          "cer": 0.4358974358974359,
          "deletions": 12,
          "insertions": 1,
          "reference_chars": 39,
          "substitutions": 4
        },
        "peak_rss_bytes": 596017152,
        "raw": {
          "cer": 0.4634146341463415,
          "deletions": 14,
          "insertions": 1,
          "reference_chars": 41,
          "substitutions": 4
        },
        "rtf": 0.011631702483533015,
        "samples": 4,
        "sentence_exact_rate": 0.25
      },
      "female": {
        "audio_s": 539.3399999999999,
        "decode_failures": 0,
        "decode_s": 4.992986207973445,
        "latency_ms_p50": 130.89316702098586,
        "latency_ms_p95": 205.566700012423,
        "normalized": {
          "cer": 0.07011686143572621,
          "deletions": 46,
          "insertions": 24,
          "reference_chars": 1797,
          "substitutions": 56
        },
        "peak_rss_bytes": 786432000,
        "raw": {
          "cer": 0.1265625,
          "deletions": 159,
          "insertions": 17,
          "reference_chars": 1920,
          "substitutions": 67
        },
        "rtf": 0.009257585582329227,
        "samples": 37,
        "sentence_exact_rate": 0.2972972972972973
      },
      "female_feminine": {
        "audio_s": 686.4839999999998,
        "decode_failures": 0,
        "decode_s": 7.140008797054179,
        "latency_ms_p50": 40.74854200007394,
        "latency_ms_p95": 84.4640641953447,
        "normalized": {
          "cer": 0.294010889292196,
          "deletions": 667,